index,ID,DATE,TO USER ACCOUNT,FROM USER ACCOUNT,REASON,SCORE 1,SCORE 2,SCORE 3,SCORE 4,DUPLICATE ID 1,DUPLICATE ID 2,DUPLICATE ID 3,DUPLICATE ID 4,DISMISSED 1,DISMISSED 2,DISMISSED 3,DISMISSED 4,QUANTIFIER 1 USERNAME,QUANTIFIER 2 USERNAME,QUANTIFIER 3 USERNAME,QUANTIFIER 4 USERNAME,AVG SCORE,SPREAD
548,6256d00b7d6ca6ad95bd562e,2022-01-10T23:00:00.000Z,angieberryberry#9822,Mount Manu#3530,for contributing to our Comms / T.E.A.M. WG,5.0,1.0,5.0,21.0,,,,,False,False,False,False,Maxwe11#7157,lee0007#8152,PhilH#1102,Parrachia#0450,8.0,20.0
496,6256d00b7d6ca6ad95bd55fa,2022-01-10T23:00:00.000Z,Tam2140#9361,ZER8🧠#9093,for their incredible work with the Comms work and the others for their curiosity about the new T.E.A.M. DAO,8.0,21.0,8.0,1.0,,,,,False,False,False,False,Mount Manu#3530,missgene#7773,divine_comedian#5493,boonjue.eth#7124,9.5,20.0
1308,6256d00b7d6ca6ad95bd5926,2022-01-20T23:00:00.000Z,eduardovegap#0422,Mount Manu#3530,for being such an all-star with the onboarding of new members,21.0,5.0,3.0,1.0,,,,,False,False,False,False,Zeptimus#3359,missgene#7773,Usua◎ Silver#2618,boonjue.eth#7124,7.5,20.0
1635,6256d00b7d6ca6ad95bd5a6d,2022-01-26T23:00:00.000Z,karmaticacid#1218,liviade#1387,for keeping the memes alive!,21.0,8.0,8.0,1.0,,,,,False,False,False,False,Zeptimus#3359,Mike Brunt#0745,shawn#7046,eduardovegap#0422,9.5,20.0
768,6256d00b7d6ca6ad95bd570a,2022-01-13T23:00:00.000Z,EvoMensch#5604,iviangita#3204,for mentioning or retweeting TE Commons on the socials the past week! Thank you for helping us grow the Token Engineering Commons community and spreading the message! 🙏🏼,1.0,21.0,1.0,,,,,,False,False,False,False,Maxwe11#7157,Mike Brunt#0745,shawn#7046,innov8tor3#3988,7.67,20.0
1207,6256d00b7d6ca6ad95bd58c1,2022-01-20T23:00:00.000Z,danlessa#2831,freshelle#9882,for engaging in discussion on the TE Commons Forum (https://forum.tecommons.org) the past week. Thank you for helping our Token Engineering Commons community share and learn! 💪🙏,1.0,21.0,13.0,1.0,,,,,False,False,False,False,Maxwe11#7157,Mike Brunt#0745,liviade#1387,Parrachia#0450,9.0,20.0
1200,6256d00b7d6ca6ad95bd58ba,2022-01-20T23:00:00.000Z,Pronoia🐙🦘#2154,freshelle#9882,for mentioning or retweeting TE Commons on the socials the past week! Thank you for helping us grow the Token Engineering Commons community and spreading the message! 🙏🏼,3.0,21.0,1.0,1.0,,,,,False,False,False,False,Mount Manu#3530,Mike Brunt#0745,shawn#7046,boonjue.eth#7124,6.5,20.0
1194,6256d00b7d6ca6ad95bd58b4,2022-01-20T23:00:00.000Z,MS#4235,freshelle#9882,for mentioning or retweeting TE Commons on the socials the past week! Thank you for helping us grow the Token Engineering Commons community and spreading the message! 🙏🏼,3.0,21.0,1.0,,,,,,False,False,False,False,Zeptimus#3359,Mike Brunt#0745,Usua◎ Silver#2618,innov8tor3#3988,8.33,20.0
1334,6256d00b7d6ca6ad95bd5940,2022-01-20T23:00:00.000Z,"griff (💜, 💜)#8888",Mount Manu#3530,for being so welcoming in Costa Rica (atte. Edu),5.0,8.0,21.0,1.0,,,,,False,False,False,False,Mount Manu#3530,bends#3537,tigeroid#2951,eduardovegap#0422,8.75,20.0
1193,6256d00b7d6ca6ad95bd58b3,2022-01-20T23:00:00.000Z,mafer_cordovas#1034,freshelle#9882,for mentioning or retweeting TE Commons on the socials the past week! Thank you for helping us grow the Token Engineering Commons community and spreading the message! 🙏🏼,1.0,21.0,1.0,1.0,,,,,False,False,False,False,Maxwe11#7157,Mike Brunt#0745,Usua◎ Silver#2618,eduardovegap#0422,6.0,20.0
967,6256d00b7d6ca6ad95bd57d1,2022-01-16T23:00:00.000Z,divine_comedian#5493,Mount Manu#3530,for working together on the Quantifier role,5.0,1.0,5.0,21.0,,,,,False,False,False,False,zhiwei#1356,Tam2140#9361,liviade#1387,bear100#9085,8.0,20.0
666,6256d00b7d6ca6ad95bd56a4,2022-01-10T23:00:00.000Z,eduardovegap#0422,Mount Manu#3530,for your continuous support to new members,21.0,3.0,8.0,1.0,6256d00b7d6ca6ad95bd567f,6256d00b7d6ca6ad95bd567f,,,False,False,False,False,Zeptimus#3359,missgene#7773,Usua◎ Silver#2618,boonjue.eth#7124,2.85,20.0
1016,6256d00b7d6ca6ad95bd5802,2022-01-16T23:00:00.000Z,Tam2140#9361,Mount Manu#3530,for advocating for final proposals,8.0,8.0,21.0,1.0,,,6256d00b7d6ca6ad95bd57c9,,False,False,False,False,Mount Manu#3530,missgene#7773,divine_comedian#5493,boonjue.eth#7124,4.78,20.0
1214,6256d00b7d6ca6ad95bd58c8,2022-01-20T23:00:00.000Z,Tam2140#9361,Mount Manu#3530,for always hosting great retrospective calls (HOW DOES SHE DO IT!!?!?!>!?),13.0,8.0,21.0,1.0,,,,,False,False,False,False,Mount Manu#3530,missgene#7773,divine_comedian#5493,boonjue.eth#7124,10.75,20.0
268,6256d00a7d6ca6ad95bd5516,2022-01-09T23:00:00.000Z,taxil#8577,iviangita#3204,for mentioning or retweeting TE Commons on the socials the past week! Thank you for helping us grow the Token Engineering Commons community and spreading the message! 🙏🏼,1.0,21.0,1.0,,,6256d00a7d6ca6ad95bd5440,,,False,False,False,False,Maxwe11#7157,Mike Brunt#0745,shawn#7046,"griff (💜, 💜)#8888",1.37,20.0
1538,6256d00b7d6ca6ad95bd5a0c,2022-01-25T23:00:00.000Z,ygg_anderson#4998,Zeptimus#3359,for always doing back up on the calls you join 🙏🔥,21.0,5.0,8.0,1.0,,,,,False,False,False,False,Zeptimus#3359,lee0007#8152,liviade#1387,boonjue.eth#7124,8.75,20.0
266,6256d00a7d6ca6ad95bd5514,2022-01-09T23:00:00.000Z,MS#4235,iviangita#3204,for mentioning or retweeting TE Commons on the socials the past week! Thank you for helping us grow the Token Engineering Commons community and spreading the message! 🙏🏼,1.0,21.0,1.0,,,621f79e443b89009366ca7c2,,,False,False,False,False,Zeptimus#3359,Mike Brunt#0745,Usua◎ Silver#2618,innov8tor3#3988,1.37,20.0
274,6256d00a7d6ca6ad95bd551c,2022-01-09T23:00:00.000Z,Disruption Joe | Gitcoin#6464,iviangita#3204,for mentioning or retweeting TE Commons on the socials the past week! Thank you for helping us grow the Token Engineering Commons community and spreading the message! 🙏🏼,1.0,21.0,1.0,,,,,,False,False,False,False,Maxwe11#7157,Mike Brunt#0745,divine_comedian#5493,innov8tor3#3988,7.67,20.0
837,6256d00b7d6ca6ad95bd574f,2022-01-15T23:00:00.000Z,eduardovegap#0422,Mount Manu#3530,"for having stewarded our community onward since the genesis, through the Hatch and now passed the Commons Upgrade",13.0,21.0,5.0,1.0,,,,,False,False,False,False,Zeptimus#3359,missgene#7773,Usua◎ Silver#2618,boonjue.eth#7124,10.0,20.0
851,6256d00b7d6ca6ad95bd575d,2022-01-15T23:00:00.000Z,acidlazzer#5796,Mount Manu#3530,for all his support (not only in the graphics sector bu also in the morale sector),21.0,8.0,8.0,1.0,,,,,False,False,False,False,zhiwei#1356,AmwFund#0979,tigeroid#2951,boonjue.eth#7124,9.5,20.0
924,6256d00b7d6ca6ad95bd57a6,2022-01-15T23:00:00.000Z,acidlazzer#5796,Mount Manu#3530,for all the graphics work and being a really cool person,21.0,8.0,8.0,1.0,,6256d00b7d6ca6ad95bd575d,,,False,False,False,False,zhiwei#1356,AmwFund#0979,tigeroid#2951,boonjue.eth#7124,7.7,20.0
189,6256d00a7d6ca6ad95bd54c7,2022-01-09T23:00:00.000Z,acidlazzer#5796,Mount Manu#3530,for contributing to the Voter’s Pamphlet issue,21.0,8.0,8.0,1.0,,,,,False,False,False,False,zhiwei#1356,AmwFund#0979,tigeroid#2951,boonjue.eth#7124,9.5,20.0
1493,6256d00b7d6ca6ad95bd59df,2022-01-23T23:00:00.000Z,alantv#0964,acidlazzer#5796,for attending the Animation TEAM call and make a cool brainstorm about the upcoming reward system video 🤖 📹,5.0,3.0,21.0,1.0,,,,,False,False,False,False,Mount Manu#3530,bends#3537,tigeroid#2951,Parrachia#0450,7.5,20.0
258,6256d00a7d6ca6ad95bd550c,2022-01-09T23:00:00.000Z,bends#3537,iviangita#3204,for mentioning or retweeting TE Commons on the socials the past week! Thank you for helping us grow the Token Engineering Commons community and spreading the message! 🙏🏼,,21.0,1.0,1.0,,,,,False,False,False,False,Mettodo#7010,Mike Brunt#0745,divine_comedian#5493,Parrachia#0450,7.67,20.0
1625,6256d00b7d6ca6ad95bd5a63,2022-01-26T23:00:00.000Z,Vyvy-vi#5040,Yineisy Mota#1449,for their leadership!,,3.0,5.0,21.0,,,,6256d00b7d6ca6ad95bd59b0,False,False,False,False,Mettodo#7010,Tam2140#9361,divine_comedian#5493,bear100#9085,3.37,18.0
1149,6256d00b7d6ca6ad95bd5887,2022-01-18T23:00:00.000Z,durgadas#9280,Jeremy&TheGospelOfChange#8201,for reaching out helping me feel seen welcome,13.0,3.0,8.0,21.0,,,,6256d00b7d6ca6ad95bd57e9,False,False,False,False,zhiwei#1356,missgene#7773,liviade#1387,Parrachia#0450,6.53,18.0
1721,6256d00b7d6ca6ad95bd5ac3,2022-01-30T23:00:00.000Z,alantv#0964,acidlazzer#5796,"for attending the Animation and Video Production TEAM, great brainstorming session about the next reward system video!",5.0,3.0,21.0,3.0,,,6256d00b7d6ca6ad95bd59df,,False,False,False,False,Mount Manu#3530,bends#3537,tigeroid#2951,Parrachia#0450,3.27,18.0
745,6256d00b7d6ca6ad95bd56f3,2022-01-12T23:00:00.000Z,eduardovegap#0422,Tam2140#9361,for devotion to community building and creating spaces for relationship building and high vibes!,21.0,13.0,8.0,3.0,,,,,False,False,False,False,Zeptimus#3359,missgene#7773,Usua◎ Silver#2618,boonjue.eth#7124,11.25,18.0
960,6256d00b7d6ca6ad95bd57ca,2022-01-16T23:00:00.000Z,karmaticacid#1218,Mount Manu#3530,for their support and argumentation for their different proposals,21.0,8.0,13.0,3.0,,,,,False,False,False,False,Zeptimus#3359,Mike Brunt#0745,shawn#7046,eduardovegap#0422,11.25,18.0
1226,6256d00b7d6ca6ad95bd58d4,2022-01-20T23:00:00.000Z,divine_comedian#5493,Mount Manu#3530,for this week's Praise Dashboard Trial Quant event,8.0,3.0,8.0,21.0,,,,,False,False,False,False,zhiwei#1356,Tam2140#9361,liviade#1387,bear100#9085,10.0,18.0
991,6256d00b7d6ca6ad95bd57e9,2022-01-16T23:00:00.000Z,durgadas#9280,Mount Manu#3530,for all the support they offer to the community,8.0,3.0,8.0,21.0,,,,,False,False,False,False,zhiwei#1356,missgene#7773,liviade#1387,Parrachia#0450,10.0,18.0
990,6256d00b7d6ca6ad95bd57e8,2022-01-16T23:00:00.000Z,Juankbell#7458,Mount Manu#3530,for all the support they offer to the community,,21.0,5.0,3.0,,,,,False,False,False,False,hanners717#2022,missgene#7773,PhilH#1102,bear100#9085,9.67,18.0
1428,6256d00b7d6ca6ad95bd599e,2022-01-21T23:00:00.000Z,eduardovegap#0422,Mount Manu#3530,for progress on the Communitas WG,21.0,5.0,5.0,3.0,,,,,False,False,False,False,Zeptimus#3359,missgene#7773,Usua◎ Silver#2618,boonjue.eth#7124,8.5,18.0
556,6256d00b7d6ca6ad95bd5636,2022-01-10T23:00:00.000Z,natesuits#4789,Mount Manu#3530,for the work they’ve done on the Rewards System research initiative,3.0,13.0,8.0,21.0,,,,,False,False,False,False,Mount Manu#3530,Tam2140#9361,PhilH#1102,bear100#9085,11.25,18.0
747,6256d00b7d6ca6ad95bd56f5,2022-01-12T23:00:00.000Z,Tam2140#9361,Zeptimus#3359,for helping so much with the recordings prayhearts,5.0,8.0,21.0,3.0,,,,,False,False,False,False,Mount Manu#3530,missgene#7773,divine_comedian#5493,boonjue.eth#7124,9.25,18.0
285,6256d00a7d6ca6ad95bd5527,2022-01-09T23:00:00.000Z,GideonRo#3175,Mount Manu#3530,for always being on top of the latest news in the ecosystem,5.0,3.0,21.0,,,,,,False,False,False,False,Mount Manu#3530,lee0007#8152,divine_comedian#5493,"griff (💜, 💜)#8888",9.67,18.0
491,6256d00b7d6ca6ad95bd55f5,2022-01-10T23:00:00.000Z,ZER8🧠#9093,ZER8🧠#9093,for their incredible work with the Comms work and the others for their curiosity about the new T.E.A.M. DAO,,3.0,3.0,21.0,,,,,False,False,False,False,Mettodo#7010,Tam2140#9361,liviade#1387,Parrachia#0450,9.0,18.0
1294,6256d00b7d6ca6ad95bd5918,2022-01-20T23:00:00.000Z,liviade#1387,Mount Manu#3530,for being a calming presence and organizing the voting procedures for the TEC,,21.0,13.0,3.0,,,,,False,False,False,False,Mettodo#7010,AmwFund#0979,divine_comedian#5493,boonjue.eth#7124,12.33,18.0
523,6256d00b7d6ca6ad95bd5615,2022-01-10T23:00:00.000Z,Tam2140#9361,Mount Manu#3530,for always being everywhere and giving great feedback and opinions,5.0,5.0,21.0,3.0,,,,,False,False,False,False,Mount Manu#3530,missgene#7773,divine_comedian#5493,boonjue.eth#7124,8.5,18.0
228,6256d00a7d6ca6ad95bd54ee,2022-01-09T23:00:00.000Z,"griff (💜, 💜)#8888",Mount Manu#3530,for bringing Mafer in as a contributor and making her feel supported,3.0,5.0,21.0,3.0,,,,,False,False,False,False,Mount Manu#3530,bends#3537,tigeroid#2951,eduardovegap#0422,8.0,18.0
1552,6256d00b7d6ca6ad95bd5a1a,2022-01-25T23:00:00.000Z,Letty#5399,nic#9212,for giving helpful feedback for the articles I wrote,8.0,3.0,21.0,8.0,,,,,False,False,False,False,Maxwe11#7157,Tam2140#9361,tigeroid#2951,bear100#9085,10.0,18.0
1476,6256d00b7d6ca6ad95bd59ce,2022-01-21T23:00:00.000Z,ygg_anderson#4998,🐙 octopus#5508,for taking time to teach me important skills and perspectives recently. I'm grateful.,21.0,5.0,13.0,3.0,,,,,False,False,False,False,Zeptimus#3359,lee0007#8152,liviade#1387,boonjue.eth#7124,10.5,18.0
880,6256d00b7d6ca6ad95bd577a,2022-01-15T23:00:00.000Z,angieberryberry#9822,Mount Manu#3530,for so much work getting the TE Academy team good & ready,8.0,3.0,8.0,21.0,,,,,False,False,False,False,Maxwe11#7157,lee0007#8152,PhilH#1102,Parrachia#0450,10.0,18.0
202,6256d00a7d6ca6ad95bd54d4,2022-01-09T23:00:00.000Z,mheuer#9922,Juankbell#7458,for for recommending this video. I really like how we are starting to find voices in the space for conflict management. Will try to connect with him (merjlin) I'm sure we will have a lot to talk about 🙂 - https://www.youtube.com/watch?v=Gng6-nfITkY,,3.0,21.0,3.0,,,,,False,False,False,False,Mettodo#7010,bends#3537,tigeroid#2951,boonjue.eth#7124,9.0,18.0
1038,6256d00b7d6ca6ad95bd5818,2022-01-16T23:00:00.000Z,Tam2140#9361,Mount Manu#3530,for always leading great Stewards calls and manning that ship so gracefully,8.0,13.0,21.0,3.0,,,,,False,False,False,False,Mount Manu#3530,missgene#7773,divine_comedian#5493,boonjue.eth#7124,11.25,18.0
1314,6256d00b7d6ca6ad95bd592c,2022-01-20T23:00:00.000Z,Letty#5399,Mount Manu#3530,"for the articles that they wrote, which will be coming out soon",8.0,3.0,13.0,21.0,,,,6256d00b7d6ca6ad95bd587d,False,False,False,False,Maxwe11#7157,Tam2140#9361,tigeroid#2951,bear100#9085,6.53,18.0
649,6256d00b7d6ca6ad95bd5693,2022-01-10T23:00:00.000Z,Zeptimus#3359,Mount Manu#3530,for all the recordings that you guys assemble: now we have over a year of recordings,3.0,21.0,13.0,13.0,,6256d00b7d6ca6ad95bd564b,,6256d00a7d6ca6ad95bd5498,False,False,False,False,zhiwei#1356,AmwFund#0979,liviade#1387,Parrachia#0450,4.85,18.0
1651,6256d00b7d6ca6ad95bd5a7d,2022-01-26T23:00:00.000Z,liviade#1387,pat.zip (TE Academy)#5266,for bringing the rewards program to life and with consistent work reaching the 18th lesson successfully,,13.0,21.0,3.0,,,6256d00b7d6ca6ad95bd5a40,,False,False,False,False,Mettodo#7010,AmwFund#0979,divine_comedian#5493,boonjue.eth#7124,6.03,18.0
1373,6256d00b7d6ca6ad95bd5967,2022-01-20T23:00:00.000Z,acidlazzer#5796,Mount Manu#3530,for your progress on video production efforts,8.0,5.0,21.0,3.0,,,,,False,False,False,False,zhiwei#1356,AmwFund#0979,tigeroid#2951,boonjue.eth#7124,9.25,18.0
833,6256d00b7d6ca6ad95bd574b,2022-01-15T23:00:00.000Z,liviade#1387,Mount Manu#3530,"for having stewarded our community onward since the genesis, through the Hatch and now passed the Commons Upgrade",,21.0,21.0,3.0,,,,,False,False,False,False,Mettodo#7010,AmwFund#0979,divine_comedian#5493,boonjue.eth#7124,15.0,18.0
1503,6256d00b7d6ca6ad95bd59e9,2022-01-23T23:00:00.000Z,karmaticacid#1218,acidlazzer#5796,for drafting amazing tweets for the Token Launch campaign! 📢 ✏️,13.0,21.0,3.0,5.0,,,,,False,False,False,False,Zeptimus#3359,Mike Brunt#0745,shawn#7046,eduardovegap#0422,10.5,18.0
315,6256d00a7d6ca6ad95bd5545,2022-01-09T23:00:00.000Z,ygg_anderson#4998,Mount Manu#3530,"for getting us to this point, almost done with the CU",13.0,8.0,21.0,3.0,,,,,False,False,False,False,Zeptimus#3359,lee0007#8152,liviade#1387,boonjue.eth#7124,11.25,18.0
1285,6256d00b7d6ca6ad95bd590f,2022-01-20T23:00:00.000Z,GideonRo#3175,Mount Manu#3530,for feedback on some content that the TEC is getting ready to publish,5.0,3.0,21.0,,,,,,False,False,False,False,Mount Manu#3530,lee0007#8152,divine_comedian#5493,"griff (💜, 💜)#8888",9.67,18.0
241,6256d00a7d6ca6ad95bd54fb,2022-01-09T23:00:00.000Z,natesuits#4789,Mount Manu#3530,for making the TEC such a warm and welcoming community,8.0,5.0,3.0,21.0,,,,,False,False,False,False,Mount Manu#3530,Tam2140#9361,PhilH#1102,bear100#9085,9.25,18.0
868,6256d00b7d6ca6ad95bd576e,2022-01-15T23:00:00.000Z,liviade#1387,Mount Manu#3530,for all the decision-processes that she has fostered in the TEC,,21.0,8.0,3.0,,6256d00b7d6ca6ad95bd574b,,,False,False,False,False,Mettodo#7010,AmwFund#0979,divine_comedian#5493,boonjue.eth#7124,4.37,18.0
512,6256d00b7d6ca6ad95bd560a,2022-01-10T23:00:00.000Z,Juankbell#7458,Mount Manu#3530,for helping Bianca introduce a psychology dimension into the TEC,,3.0,3.0,21.0,,,,,False,False,False,False,hanners717#2022,missgene#7773,PhilH#1102,bear100#9085,9.0,18.0
229,6256d00a7d6ca6ad95bd54ef,2022-01-09T23:00:00.000Z,karmaticacid#1218,Mount Manu#3530,for the excellent onboarding sessions that she guided Mafer through earlier this week,21.0,13.0,5.0,3.0,,,,,False,False,False,False,Zeptimus#3359,Mike Brunt#0745,shawn#7046,eduardovegap#0422,10.5,18.0
1301,6256d00b7d6ca6ad95bd591f,2022-01-20T23:00:00.000Z,karmaticacid#1218,Mount Manu#3530,for helping our DAO evolve into its next phase,21.0,13.0,8.0,5.0,,,,,False,False,False,False,Zeptimus#3359,Mike Brunt#0745,shawn#7046,eduardovegap#0422,11.75,16.0
1230,6256d00b7d6ca6ad95bd58d8,2022-01-20T23:00:00.000Z,Juankbell#7458,Mount Manu#3530,for the work they did around Tweet planning & posting,,13.0,5.0,21.0,,,,,False,False,False,False,hanners717#2022,missgene#7773,PhilH#1102,bear100#9085,13.0,16.0
650,6256d00b7d6ca6ad95bd5694,2022-01-10T23:00:00.000Z,iviangita#3204,Mount Manu#3530,for all the recordings that you guys assemble: now we have over a year of recordings,,5.0,8.0,21.0,,,,,False,False,False,False,Mettodo#7010,bends#3537,Usua◎ Silver#2618,eduardovegap#0422,11.33,16.0
1730,6256d00b7d6ca6ad95bd5acc,2022-01-30T23:00:00.000Z,willyfox#1178,chuygarcia.eth#6692,for DAOing it in coindesk's article,,5.0,8.0,21.0,,,,,False,False,False,False,hanners717#2022,bends#3537,shawn#7046,bear100#9085,11.33,16.0
558,6256d00b7d6ca6ad95bd5638,2022-01-10T23:00:00.000Z,anna-marie#8824,Mount Manu#3530,for sharing great sushi together with Chuy in their Mexico City rendezvous,8.0,5.0,21.0,,6256d00b7d6ca6ad95bd55a2,,,,False,False,False,False,Maxwe11#7157,bends#3537,tigeroid#2951,innov8tor3#3988,8.93,16.0
557,6256d00b7d6ca6ad95bd5637,2022-01-10T23:00:00.000Z,Juankbell#7458,Mount Manu#3530,for the work they’ve done on the Rewards System research initiative,,21.0,5.0,13.0,,,,,False,False,False,False,hanners717#2022,missgene#7773,PhilH#1102,bear100#9085,13.0,16.0
37,621f79e443b89009366ca7e1,2021-12-28T23:00:00.000Z,chuygarcia.eth#6692,acidlazzer#5796,for a super chill Commons Upgrade proposal presentation working session ❤️,,21.0,5.0,,,,,,False,False,False,False,hanners717#2022,Mike Brunt#0745,Usua◎ Silver#2618,innov8tor3#3988,13.0,16.0
1477,6256d00b7d6ca6ad95bd59cf,2022-01-21T23:00:00.000Z,ALOYSIOUS#3049,🐙 octopus#5508,for taking time to teach me important skills and perspectives recently. I'm grateful.,21.0,5.0,5.0,,,,,,False,False,False,False,Zeptimus#3359,lee0007#8152,shawn#7046,innov8tor3#3988,10.33,16.0
1124,6256d00b7d6ca6ad95bd586e,2022-01-17T23:00:00.000Z,divine_comedian#5493,Zeptimus#3359,for writing the quantifier onboarding doc it was a team effort 🤙🙏,21.0,21.0,5.0,21.0,,,6256d00b7d6ca6ad95bd57d1,,False,False,False,False,zhiwei#1356,Tam2140#9361,liviade#1387,bear100#9085,15.88,16.0
1009,6256d00b7d6ca6ad95bd57fb,2022-01-16T23:00:00.000Z,durgadas#9280,Mount Manu#3530,"for being a wise mentor, consistently",13.0,5.0,13.0,21.0,,,,6256d00b7d6ca6ad95bd57e9,False,False,False,False,zhiwei#1356,missgene#7773,liviade#1387,Parrachia#0450,8.28,16.0
1139,6256d00b7d6ca6ad95bd587d,2022-01-18T23:00:00.000Z,Letty#5399,solsista#5370,"for the article describing the TEC Lib genesis, will make it so much easier to reach out to initial seeders with limited time to get excited to be part of this",8.0,13.0,5.0,21.0,,,,,False,False,False,False,Maxwe11#7157,Tam2140#9361,tigeroid#2951,bear100#9085,11.75,16.0
1542,6256d00b7d6ca6ad95bd5a10,2022-01-25T23:00:00.000Z,stef#9877,nic#9212,for really great artwork for the library 🤩,13.0,5.0,8.0,21.0,,,,,False,False,False,False,Maxwe11#7157,lee0007#8152,shawn#7046,bear100#9085,11.75,16.0
1515,6256d00b7d6ca6ad95bd59f5,2022-01-24T23:00:00.000Z,VitorNunes#0090,"griff (💜, 💜)#8888",for getting the TEC token listed on Coingecko: https://www.coingecko.com/en/coins/token-engineering-commons,,5.0,21.0,,,,,,False,False,False,False,hanners717#2022,bends#3537,liviade#1387,innov8tor3#3988,13.0,16.0
1648,6256d00b7d6ca6ad95bd5a7a,2022-01-26T23:00:00.000Z,pat.zip (TE Academy)#5266,chuygarcia.eth#6692,for making the TE Academy TEAM feel welcomed while you walk us through comms,5.0,21.0,5.0,21.0,,,,,False,False,False,False,Maxwe11#7157,Mike Brunt#0745,Usua◎ Silver#2618,Parrachia#0450,13.0,16.0
1642,6256d00b7d6ca6ad95bd5a74,2022-01-26T23:00:00.000Z,solsista#5370,chuygarcia.eth#6692,for being an inspiration for token engineers (even those who don't know yet 😉),,21.0,5.0,8.0,,,,6256d00a7d6ca6ad95bd54e6,False,False,False,False,Mettodo#7010,Tam2140#9361,Usua◎ Silver#2618,Parrachia#0450,8.93,16.0
718,6256d00b7d6ca6ad95bd56d8,2022-01-12T23:00:00.000Z,"griff (💜, 💜)#8888",divine_comedian#5493,for his winning commons upgrade design,5.0,21.0,21.0,8.0,,6256d00b7d6ca6ad95bd56a5,,,False,False,False,False,Mount Manu#3530,bends#3537,tigeroid#2951,eduardovegap#0422,9.03,16.0
1135,6256d00b7d6ca6ad95bd5879,2022-01-18T23:00:00.000Z,nic#9212,solsista#5370,"for jamming asynchronously on visuals for TEC Lib and sharing it with the group here, lifts the mood!!!",8.0,21.0,5.0,,,,,,False,False,False,False,Maxwe11#7157,Mike Brunt#0745,shawn#7046,"griff (💜, 💜)#8888",11.33,16.0
568,6256d00b7d6ca6ad95bd5642,2022-01-10T23:00:00.000Z,mateodaza#3156,Mount Manu#3530,"for their work in Giveth, which energizes our whole community with giving vibes",,8.0,21.0,5.0,,6256d00b7d6ca6ad95bd560d,621f79e443b89009366ca7d8,,False,False,False,False,Mettodo#7010,missgene#7773,PhilH#1102,bear100#9085,2.63,16.0
695,6256d00b7d6ca6ad95bd56c1,2022-01-12T23:00:00.000Z,Zeptimus#3359,Tam2140#9361,for being so available and patient and supportive when I have questions! That means a lot.,8.0,5.0,21.0,21.0,,,,,False,False,False,False,zhiwei#1356,AmwFund#0979,liviade#1387,Parrachia#0450,13.75,16.0
618,6256d00b7d6ca6ad95bd5674,2022-01-10T23:00:00.000Z,chuygarcia.eth#6692,Mount Manu#3530,for sharing with Juanka the odyssey that is creating a service DAO,,21.0,5.0,,,,,,False,False,False,False,hanners717#2022,Mike Brunt#0745,Usua◎ Silver#2618,innov8tor3#3988,13.0,16.0
732,6256d00b7d6ca6ad95bd56e6,2022-01-12T23:00:00.000Z,Mert Ozd#6679,Tam2140#9361,"for taking on being a liason between TEC and PrimeDAO, there are going to be some very great initiatives coming out of our collaborations!",21.0,5.0,13.0,,,,6256d00b7d6ca6ad95bd55ec,,False,False,False,False,Zeptimus#3359,lee0007#8152,PhilH#1102,innov8tor3#3988,9.1,16.0
1134,6256d00b7d6ca6ad95bd5878,2022-01-18T23:00:00.000Z,stef#9877,solsista#5370,"for jamming asynchronously on visuals for TEC Lib and sharing it with the group here, lifts the mood!!!",5.0,5.0,13.0,21.0,,,,,False,False,False,False,Maxwe11#7157,lee0007#8152,shawn#7046,bear100#9085,11.0,16.0
320,6256d00a7d6ca6ad95bd554a,2022-01-09T23:00:00.000Z,alantv#0964,Mount Manu#3530,for their daily commitment with the animation team that they’re part of,8.0,5.0,13.0,21.0,,,,,False,False,False,False,Mount Manu#3530,bends#3537,tigeroid#2951,Parrachia#0450,11.75,16.0
872,6256d00b7d6ca6ad95bd5772,2022-01-15T23:00:00.000Z,Nuggan#5183,Mount Manu#3530,for supporting the proposals that you argued for with clarity and conviction,21.0,8.0,5.0,,,,,,False,False,False,False,zhiwei#1356,lee0007#8152,PhilH#1102,"griff (💜, 💜)#8888",11.33,16.0
870,6256d00b7d6ca6ad95bd5770,2022-01-15T23:00:00.000Z,Tam2140#9361,Mount Manu#3530,for supporting the proposals that you argued for with clarity and conviction,8.0,5.0,21.0,5.0,,,6256d00b7d6ca6ad95bd56c3,,False,False,False,False,Mount Manu#3530,missgene#7773,divine_comedian#5493,boonjue.eth#7124,5.03,16.0
740,6256d00b7d6ca6ad95bd56ee,2022-01-12T23:00:00.000Z,divine_comedian#5493,Tam2140#9361,for ts of the Rewards WG is truly impressive!,13.0,13.0,5.0,21.0,,,,,False,False,False,False,zhiwei#1356,Tam2140#9361,liviade#1387,bear100#9085,13.0,16.0
233,6256d00a7d6ca6ad95bd54f3,2022-01-09T23:00:00.000Z,chuygarcia.eth#6692,Mount Manu#3530,for making the TEC such a warm and welcoming community,,21.0,5.0,,,,,,False,False,False,False,hanners717#2022,Mike Brunt#0745,Usua◎ Silver#2618,innov8tor3#3988,13.0,16.0
1502,6256d00b7d6ca6ad95bd59e8,2022-01-23T23:00:00.000Z,Juankbell#7458,acidlazzer#5796,for drafting amazing tweets for the Token Launch campaign! 📢 ✏️,,8.0,5.0,21.0,,,,6256d00b7d6ca6ad95bd58d8,False,False,False,False,hanners717#2022,missgene#7773,PhilH#1102,bear100#9085,5.03,16.0
729,6256d00b7d6ca6ad95bd56e3,2022-01-12T23:00:00.000Z,"griff (💜, 💜)#8888",Tam2140#9361,for making the Commons upgrade a reality. Can't happen without you!,13.0,21.0,21.0,5.0,,6256d00b7d6ca6ad95bd56a5,,,False,False,False,False,Mount Manu#3530,bends#3537,tigeroid#2951,eduardovegap#0422,10.28,16.0
859,6256d00b7d6ca6ad95bd5765,2022-01-15T23:00:00.000Z,Tam2140#9361,Mount Manu#3530,for always being available and for always facilitating such good brainstorming sessions such as the Stewards Council,13.0,5.0,21.0,5.0,,,6256d00b7d6ca6ad95bd56d1,,False,False,False,False,Mount Manu#3530,missgene#7773,divine_comedian#5493,boonjue.eth#7124,6.28,16.0
725,6256d00b7d6ca6ad95bd56df,2022-01-12T23:00:00.000Z,mafer_cordovas#1034,Tam2140#9361,for looking out for the Trusted Seed (so every one of our Hatchers and then some) and all the support you provide there!🌱,5.0,21.0,8.0,5.0,,,,,False,False,False,False,Maxwe11#7157,Mike Brunt#0745,Usua◎ Silver#2618,eduardovegap#0422,9.75,16.0
